[
  {
    "schema_version": "1.0.0",
    "id": "source:gbif_monstera_deliciosa",
    "organization": "Global Biodiversity Information Facility",
    "title": "Monstera deliciosa Liebm. — GBIF Backbone Taxonomy",
    "url": "https://www.gbif.org/species/2868241",
    "source_type": "taxonomy_database",
    "authority_tier": 1,
    "accessed_at": "2026-08-11",
    "copyright_status": "review_required",
    "usage": "link_and_paraphrase_only",
    "notes": "用于 accepted scientific name、分类层级和同物异名；批量导入前需单独复核数据集许可。"
  },
  {
    "schema_version": "1.0.0",
    "id": "source:gbif_epipremnum_aureum",
    "organization": "Global Biodiversity Information Facility",
    "title": "Epipremnum aureum (Linden & André) G.S.Bunting — GBIF Backbone Taxonomy",
    "url": "https://www.gbif.org/species/2868323",
    "source_type": "taxonomy_database",
    "authority_tier": 1,
    "accessed_at": "2026-08-11",
    "copyright_status": "review_required",
    "usage": "link_and_paraphrase_only",
    "notes": "用于 accepted scientific name、分类层级和同物异名；批量导入前需单独复核数据集许可。"
  },
  {
    "schema_version": "1.0.0",
    "id": "source:gbif_dracaena_trifasciata",
    "organization": "Global Biodiversity Information Facility",
    "title": "Dracaena trifasciata (Prain) Mabb. — GBIF Backbone Taxonomy",
    "url": "https://www.gbif.org/species/11041822",
    "source_type": "taxonomy_database",
    "authority_tier": 1,
    "accessed_at": "2026-08-11",
    "copyright_status": "review_required",
    "usage": "link_and_paraphrase_only",
    "notes": "用于 accepted scientific name、分类层级和同物异名；批量导入前需单独复核数据集许可。"
  },
  {
    "schema_version": "1.0.0",
    "id": "source:ncsu_monstera_deliciosa",
    "organization": "North Carolina State University Extension",
    "title": "Monstera deliciosa — Extension Gardener Plant Toolbox",
    "url": "https://plants.ces.ncsu.edu/plants/monstera-deliciosa/",
    "source_type": "university_extension",
    "authority_tier": 1,
    "accessed_at": "2026-08-11",
    "copyright_status": "review_required",
    "usage": "link_and_paraphrase_only",
    "notes": "仅保存短事实性改写与页面定位，不复制正文或图片。"
  },
  {
    "schema_version": "1.0.0",
    "id": "source:ncsu_epipremnum_aureum",
    "organization": "North Carolina State University Extension",
    "title": "Epipremnum aureum — Extension Gardener Plant Toolbox",
    "url": "https://plants.ces.ncsu.edu/plants/epipremnum-aureum/",
    "source_type": "university_extension",
    "authority_tier": 1,
    "accessed_at": "2026-08-11",
    "copyright_status": "review_required",
    "usage": "link_and_paraphrase_only",
    "notes": "仅保存短事实性改写与页面定位，不复制正文或图片。"
  },
  {
    "schema_version": "1.0.0",
    "id": "source:ncsu_dracaena_trifasciata",
    "organization": "North Carolina State University Extension",
    "title": "Dracaena trifasciata — Extension Gardener Plant Toolbox",
    "url": "https://plants.ces.ncsu.edu/plants/dracaena-trifasciata/",
    "source_type": "university_extension",
    "authority_tier": 1,
    "accessed_at": "2026-08-11",
    "copyright_status": "review_required",
    "usage": "link_and_paraphrase_only",
    "notes": "仅保存短事实性改写与页面定位，不复制正文或图片。"
  },
  {
    "schema_version": "1.0.0",
    "id": "source:aspca_monstera_deliciosa",
    "organization": "American Society for the Prevention of Cruelty to Animals",
    "title": "Toxic and Non-toxic Plants: Swiss Cheese Plant — Monstera deliciosa",
    "url": "https://www.aspca.org/pet-care/aspca-poison-control/toxic-and-non-toxic-plants/swiss-cheese-plant",
    "source_type": "veterinary_poison_database",
    "authority_tier": 1,
    "accessed_at": "2026-08-11",
    "copyright_status": "review_required",
    "usage": "link_and_paraphrase_only",
    "notes": "页面 Scientific Name 明确为 Monstera deliciosa；用于犬猫毒性、毒性成分、临床表现和暴露后行动，并与 NCSU 条目交叉核对。"
  },
  {
    "schema_version": "1.0.0",
    "id": "source:aspca_epipremnum_aureum",
    "organization": "American Society for the Prevention of Cruelty to Animals",
    "title": "Toxic and Non-toxic Plants: Golden Pothos — Epipremnum aureum",
    "url": "https://www.aspca.org/pet-care/aspca-poison-control/toxic-and-non-toxic-plants/golden-pothos",
    "source_type": "veterinary_poison_database",
    "authority_tier": 1,
    "accessed_at": "2026-08-11",
    "copyright_status": "review_required",
    "usage": "link_and_paraphrase_only",
    "notes": "页面 Scientific Name 明确为 Epipremnum aureum；用于犬猫毒性、毒性成分、临床表现和暴露后行动，并与 NCSU 条目交叉核对。"
  },
  {
    "schema_version": "1.0.0",
    "id": "source:aspca_dracaena_trifasciata",
    "organization": "American Society for the Prevention of Cruelty to Animals",
    "title": "Toxic and Non-toxic Plants: Snake Plant — Sansevieria trifasciata",
    "url": "https://www.aspca.org/pet-care/aspca-poison-control/toxic-and-non-toxic-plants/snake-plant",
    "source_type": "veterinary_poison_database",
    "authority_tier": 1,
    "accessed_at": "2026-08-11",
    "copyright_status": "review_required",
    "usage": "link_and_paraphrase_only",
    "notes": "页面 Scientific Name 明确为 Sansevieria trifasciata（现接受名 Dracaena trifasciata）；用于犬猫毒性、毒性成分、临床表现和暴露后行动，并与 NCSU 条目交叉核对。"
  },
  {
    "schema_version": "1.0.0",
    "id": "source:rhs_epipremnum",
    "organization": "Royal Horticultural Society",
    "title": "Houseplants for students: how to green your halls",
    "url": "https://www.rhs.org.uk/plants/types/houseplants/houseplants-for-students",
    "source_type": "horticultural_guidance",
    "authority_tier": 1,
    "accessed_at": "2026-08-11",
    "copyright_status": "review_required",
    "usage": "link_and_paraphrase_only",
    "notes": "用于绿萝的季节性实用浇水间隔；须与土壤干燥触发条件一起使用。"
  },
  {
    "schema_version": "1.0.0",
    "id": "source:umn_monstera_deliciosa",
    "organization": "University of Minnesota Extension",
    "title": "Monstera deliciosa",
    "url": "https://extension.umn.edu/gardening-minnesota/propagating-monstera-deliciosa",
    "source_type": "university_extension",
    "authority_tier": 1,
    "accessed_at": "2026-08-11",
    "copyright_status": "review_required",
    "usage": "link_and_paraphrase_only",
    "notes": "用于成熟龟背竹的每周参考与表土干燥条件，以及浇透排水动作。"
  },
  {
    "schema_version": "1.0.0",
    "id": "source:uvm_snake_plant",
    "organization": "University of Vermont Extension",
    "title": "Houseplants for the Dorm Room",
    "url": "https://www.uvm.edu/extension/news/houseplants-dorm-room",
    "source_type": "university_extension",
    "authority_tier": 1,
    "accessed_at": "2026-08-11",
    "copyright_status": "review_required",
    "usage": "link_and_paraphrase_only",
    "notes": "用于虎尾兰每隔数周的实用参考；必须与完全干燥条件一起使用。"
  },
  {
    "schema_version": "1.0.0",
    "id": "source:rhs_sansevieria_growing",
    "organization": "Royal Horticultural Society",
    "title": "How to grow sansevierias",
    "url": "https://www.rhs.org.uk/plants/sansevieria/growing-guide",
    "source_type": "horticultural_guidance",
    "authority_tier": 1,
    "accessed_at": "2026-08-11",
    "copyright_status": "review_required",
    "usage": "link_and_paraphrase_only",
    "notes": "用于虎尾兰浇水动作、湿度和湿土风险；页面仍使用旧属名。"
  },
  {
    "schema_version": "1.0.0",
    "id": "source:wisconsin_pothos",
    "organization": "University of Wisconsin–Madison Extension",
    "title": "Pothos, Epipremnum aureum",
    "url": "https://hort.extension.wisc.edu/articles/pothos-epipremmum-aureum/",
    "source_type": "university_extension",
    "authority_tier": 1,
    "accessed_at": "2026-08-11",
    "copyright_status": "review_required",
    "usage": "link_and_paraphrase_only",
    "notes": "用于绿萝自然老叶黄化、黑边多原因、湿度和温度条件。"
  },
  {
    "schema_version": "1.0.0",
    "id": "source:uconn_monstera_deliciosa",
    "organization": "University of Connecticut Home and Garden Education Center",
    "title": "Monstera deliciosa",
    "url": "https://homegarden.cahnr.uconn.edu/factsheets/monstera-deliciosa/",
    "source_type": "university_extension",
    "authority_tier": 1,
    "accessed_at": "2026-08-11",
    "copyright_status": "review_required",
    "usage": "link_and_paraphrase_only",
    "notes": "用于龟背竹细菌性叶斑、炭疽病和根茎腐烂的鉴别线索。"
  },
  {
    "schema_version": "1.0.0",
    "id": "source:vtech_houseplant_watering",
    "organization": "Virginia Cooperative Extension",
    "title": "Properly Watering Container Houseplants",
    "url": "https://www.pubs.ext.vt.edu/content/pubs_ext_vt_edu/en/SPES/spes-804.html",
    "source_type": "university_extension",
    "authority_tier": 1,
    "accessed_at": "2026-08-11",
    "copyright_status": "review_required",
    "usage": "link_and_paraphrase_only",
    "notes": "用于盆栽过湿与缺水症状、浇透和排水动作；属于通用室内盆栽指导。"
  }
]
